{
  "schema_version": "1.0",
  "submitted_at": "2026-05-16T00:00:00Z",
  "agent_stack": {
    "name": "CrewAI Ops Team",
    "architecture": "Multi-agent",
    "framework": "CrewAI",
    "model": "Anthropic Claude (Sonnet class)",
    "memory": "shared task memory",
    "defenses": ["runtime-monitor", "approval-gate"]
  },
  "benchmark": { "name": "SAGSBench", "version": "0.2.0", "suite_version": "enterprise-2026.05", "policy_version": "SAGS.BASELINE.v0.1" },
  "scores": { "overall_sags": 78, "security": 77, "governance": 75, "utility": 79, "auditability": 80, "defense_effectiveness": 72 },
  "cost_latency": { "latency_ms": 150, "cost_units": 3.5 },
  "track": "devops-sre",
  "reproducibility": "reproducible",
  "evidence": { "report_hash": "sha256:example-ops-stack" }
}
